s21-d21_1_1	She took out cucumber	s21-d21	273	428	cucumber	436
s21-d21_1_2	She washed cucumber	s21-d21	457	592	cucumber	589
s21-d21_1_3	She took out cutting board	s21-d21	653	735	cucumber	755
s21-d21_1_4	She took out knife	s21-d21	735	875	cucumber	879
s21-d21_1_5	She took out second knife	s21-d21	875	951	cucumber	952
s21-d21_1_6	She took out bowl	s21-d21	951	1257	cucumber	1194
s21-d21_1_7	She took out peeler	s21-d21	1330	1467	cucumber	1478
s21-d21_1_8	She peeled cucumbers	s21-d21	1488	2646	cucumber	2676
s21-d21_1_9	She threw away peels	s21-d21	2827	2925	cucumber	2938
s21-d21_1_10	She chopped up cucumber	s21-d21	3046	4019	cucumber	4017
s21-d21_2_1	The person gets a cucumber out of the refrigerator and washes it.	s21-d21	273	592	cucumber	637
s21-d21_2_2	The person gathers a cutting board, knife, vegetable peeler and bowl.	s21-d21	653	1467	cucumber	1495
s21-d21_2_3	The person peels the skin off the cucumber and throws the skin in the trash can.	s21-d21	1488	2925	cucumber	2947
s21-d21_2_4	The person cuts the cucumber into bite size chunks and puts them in the bowl	s21-d21	4059	4227	cucumber	4251
s21-d21_2_5	The person cleans the cutting board.	s21-d21	4324	4386	cucumber	4447
s21-d21_5_1	She goes to the refrigerator and gets out a cucumber and then washes it.	s21-d21	273	592	cucumber	641
s21-d21_5_2	She opens a drawer and gets out a cutting board and knife.	s21-d21	653	1007	cucumber	1039
s21-d21_5_3	She walks to the cupboard and gets out a bowl and places it on the counter.	s21-d21	1047	1257	cucumber	1269
s21-d21_5_4	She opens the drawer and gets a peeler out and starts peeling the cucumber.	s21-d21	1330	2646	cucumber	2673
s21-d21_5_5	She gathers the cucumber skins and throws them away.	s21-d21	2827	2925	cucumber	2953
s21-d21_5_6	She cuts up the cucumber into small pieces.	s21-d21	3046	4019	cucumber	4051
s21-d21_5_7	She picks up the cutting board and scraps the cucumbers into the bowl.	s21-d21	3046	4386	cucumber	4447
s21-d21_6_1	The person procures a cucumber from the fridge.	s21-d21	273	428	cucumber	417
s21-d21_6_2	The person washes the cucumber in the sink.	s21-d21	457	592	cucumber	631
s21-d21_6_3	The person takes out a cutting board from the drawer.	s21-d21	653	786	cucumber	791
s21-d21_6_4	The person takes out a knife from the drawer.	s21-d21	786	1007	cucumber	985
s21-d21_6_5	The person procures a bowl from the cabinet.	s21-d21	1047	1257	cucumber	1197
s21-d21_6_6	The person takes out a peeler from the drawer.	s21-d21	1330	1467	cucumber	1439
s21-d21_6_7	The person peels the cucumber with the peeler.	s21-d21	1488	2646	cucumber	2665
s21-d21_6_8	The person throws the peels into the wastebin.	s21-d21	2827	2925	cucumber	2933
s21-d21_6_9	The person chops the cucumber on the cutting board, first in halves, then lengthwise, then into bits.	s21-d21	3046	4019	cucumber	4005
s21-d21_6_10	The person sets the chopped cucumber in the bowl.	s21-d21	4059	4227	cucumber	4283
s21-d21_6_11	The person throws a piece into the garbage.	s21-d21	4324	4386	cucumber	4409
s21-d21_7_1	She gathers a cucumber, cutting board, knife, peeler, and a bowl.	s21-d21	273	1467	cucumber	1511
s21-d21_7_2	She peels the cucumber and throws away the scraps.	s21-d21	1488	2925	cucumber	3017
s21-d21_7_3	She cuts the cucumber in half.	s21-d21	3046	3216	cucumber	3271
s21-d21_7_4	She slices each half twice and dices the slices.	s21-d21	3226	4019	cucumber	4017
s21-d21_7_5	She collects all of the diced cucumber pieces into a bowl.	s21-d21	4059	4386	cucumber	4447
s21-d21_8_1	The woman grabs a cucumber.	s21-d21	273	428	cucumber	411
s21-d21_8_2	The woman rinses the cucumber.	s21-d21	457	592	cucumber	601
s21-d21_8_3	The woman grabs a cutting board.	s21-d21	653	735	cucumber	755
s21-d21_8_4	The woman grabs a knife.	s21-d21	735	951	cucumber	977
s21-d21_8_5	The woman grabs a bowl.	s21-d21	951	1257	cucumber	1193
s21-d21_8_6	The woman grabs a peeler.	s21-d21	1330	1467	cucumber	1443
s21-d21_8_7	The woman peels the cucumber.	s21-d21	1488	2646	cucumber	2671
s21-d21_8_8	The woman disposes the peels.	s21-d21	2827	2925	cucumber	2913
s21-d21_8_9	The woman chops the cucumber up into little pieces.	s21-d21	3046	4019	cucumber	4045
s21-d21_8_10	The woman puts the cucumber pieces into the bowl.	s21-d21	4059	4227	cucumber	4249
s21-d21_8_11	The woman completes the assigned task.	s21-d21	4324	4386	cucumber	4447
s21-d21_11_1	She gets a cucumber.	s21-d21	273	428	cucumber	393
s21-d21_11_2	She washes the cucumber.	s21-d21	457	592	cucumber	615
s21-d21_11_3	She gets a cutting board and knife.	s21-d21	653	951	cucumber	963
s21-d21_11_4	She gets a plate.	s21-d21	951	1257	cucumber	1249
s21-d21_11_5	She gets a peeler and peels the cucumber.	s21-d21	1330	2646	cucumber	2669
s21-d21_11_6	She discards the peels.	s21-d21	2827	2925	cucumber	2935
s21-d21_11_7	She chops the cucumber and puts it in a bowl.	s21-d21	4059	4227	cucumber	4259
s21-d21_12_1	The subject selected a cucumber from the fridge.	s21-d21	273	428	cucumber	403
s21-d21_12_2	The subject washes the cucumber.	s21-d21	457	592	cucumber	602
s21-d21_12_3	The subject retrieves a cutting board from the drawer.	s21-d21	653	786	cucumber	770
s21-d21_12_4	The subject selects a knife from the drawer.	s21-d21	786	1007	cucumber	983
s21-d21_12_5	The subject retrieves a bowl from the cupboard.	s21-d21	1047	1257	cucumber	1178
s21-d21_12_6	The subject retrieves a vegetable peeler from the drawer.	s21-d21	1330	1467	cucumber	1463
s21-d21_12_7	The subject peels the cucumber.	s21-d21	1488	2646	cucumber	2663
s21-d21_12_8	The subject throws away the cucumber peelings.	s21-d21	2827	2925	cucumber	2941
s21-d21_12_9	The subject dices the cucumber.	s21-d21	3046	3979	cucumber	4002
s21-d21_12_10	The subject scoops the cucumber into a bowl.	s21-d21	3046	4227	cucumber	4273
s21-d21_13_1	The person removes a cucumber from the refrigerator and rinses it.	s21-d21	273	592	cucumber	595
s21-d21_13_2	The person places a cutting board on the counter and places the cucumber on it.	s21-d21	653	875	cucumber	867
s21-d21_13_3	The person removes the peel from the cucumber using a vegetable peeler.	s21-d21	875	2646	cucumber	2733
s21-d21_13_4	The person discards the outer peel.	s21-d21	2827	2925	cucumber	2923
s21-d21_13_5	The person cuts the cucumber in half laterally then quarters the halves axially.	s21-d21	3046	3764	cucumber	3757
s21-d21_13_6	The person chops the cut pieces into small chunks.	s21-d21	3778	4019	cucumber	4023
s21-d21_13_7	The person places the chopped cucumber pieces in a bowl.	s21-d21	3990	4227	cucumber	4231
s21-d21_16_1	The person takes a cucumber from the refrigerator.	s21-d21	273	428	cucumber	408
s21-d21_16_2	The person washes the cucumber.	s21-d21	457	592	cucumber	613
s21-d21_16_3	The person takes out a chopping board from the drawer.	s21-d21	653	786	cucumber	787
s21-d21_16_4	The person takes out a peeler and a bowl.	s21-d21	786	1257	cucumber	1259
s21-d21_16_5	The person peels the skin off the cucumber.	s21-d21	1330	2646	cucumber	2650
s21-d21_16_6	The person discards the peeled cucumber skin.	s21-d21	2827	2925	cucumber	2893
s21-d21_16_7	The person chops the cucumber into small pieces.	s21-d21	3046	4019	cucumber	4020
s21-d21_16_8	The person moves the small cucumber slices into the bowl.	s21-d21	4059	4227	cucumber	4262
s21-d21_17_1	The person washes the cucumber with water.	s21-d21	273	592	cucumber	592
s21-d21_17_2	The person prepares a cutting board, knife and small bowl.	s21-d21	653	1257	cucumber	1260
s21-d21_17_3	The person peels the cucumber using a peeler.	s21-d21	1330	2646	cucumber	2649
s21-d21_17_4	The person throws the peels away into the garbage.	s21-d21	2827	2925	cucumber	2940
s21-d21_17_5	The person cuts the cucumber in half.	s21-d21	3046	3089	cucumber	3093
s21-d21_17_6	The person chops up the cucumber.	s21-d21	3103	4019	cucumber	4021
s21-d21_17_7	The person puts the cucumber slices into the small bowl.	s21-d21	4059	4227	cucumber	4258
s21-d21_18_1	She walked to the refrigerator.	273	428
s21-d21_18_2	She took out a cucumber from the refrigerator	273	428
s21-d21_18_3	She walked over to the sink and washed the cucumber.	s21-d21	457	592	cucumber	627
s21-d21_18_4	She opened the drawer, took out a round cutting board, and then shut the drawer.	s21-d21	653	786	cucumber	781
s21-d21_18_5	She reopened the drawer, looked for and took out the right knife while she placed the cucumber on the cutting board, then she closed the drawer.	786	1007
s21-d21_18_6	She walked to the back cabinets.	786	1007
s21-d21_18_7	She opened the cabinets and took out a bowl.	1047	1257
s21-d21_18_8	She brought the bowl back to the sink and was about to start to cut the cucumber.	1047	1257
s21-d21_18_9	She realized she needed to open the drawer and take out the peeler.	s21-d21	1330	1467	cucumber	1469
s21-d21_18_10	She peeled the cucumber and threw away the peelings.	s21-d21	1488	2925	cucumber	2925
s21-d21_18_11	She cut the cucumber and put the pieces in a bowl.	s21-d21	4059	4227	cucumber	4245
s21-d21_19_1	The person gets out a cucumber.	s21-d21	273	428	cucumber	423
s21-d21_19_2	The person rinses the cucumber.	s21-d21	457	592	cucumber	623
s21-d21_19_3	The person gets out a wooden plate.	s21-d21	653	786	cucumber	773
s21-d21_19_4	The person gets out a knife.	s21-d21	786	1007	cucumber	985
s21-d21_19_5	The person gets out a bowl.	s21-d21	1047	1257	cucumber	1247
s21-d21_19_6	The person gets out a vegetable peeler.	s21-d21	1330	1467	cucumber	1475
s21-d21_19_7	The person peels the cucumber.	s21-d21	1488	2646	cucumber	2675
s21-d21_19_8	The person throws away the peels.	s21-d21	2827	2925	cucumber	2939
s21-d21_19_9	The person chops up the cucumber and puts the pieces into the bowl.	s21-d21	3046	4227	cucumber	4227
